[
 {
  "record_kind": "package_identity",
  "format": "PKG-v0.2",
  "record_id": "PKG-EX-01",
  "app": {
   "revision": "ILLUSTRATIVE",
   "build_identity": "ILLUSTRATIVE",
   "version": "4.0.0-illustrative",
   "bundle_id": "ILLUSTRATIVE.bundle.id",
   "target": "macOS arm64",
   "signature": {
    "team": "EXAMPLE001",
    "authority": "Developer ID Application: ILLUSTRATIVE (EXAMPLE001)",
    "hardened_runtime": true,
    "timestamp": true,
    "entitlements": []
   },
   "installer": {
    "kind": "dmg",
    "file": "ILLUSTRATIVE.dmg",
    "sha256_before_notarisation": "0000000000000000000000000000000000000000000000000000000000000000"
   }
  },
  "codex": {
   "pin": "0.160.0",
   "published": {
    "manifest_sha256": "327effb91a5854eccb388321b4b160e059795f0402c553f594e85365189d8d12",
    "files": 42,
    "macho_files": 30
   },
   "packaged": {
    "manifest_sha256": "327effb91a5854eccb388321b4b160e059795f0402c553f594e85365189d8d12",
    "files": 42,
    "macho_files": 30
   },
   "launcher": {
    "kind": "vendor_binary",
    "path_in_bundle": "Contents/Resources/codex/bin/codex",
    "environment_added": []
   },
   "executables": [
    {
     "path": "bin/codex",
     "sha256_published": "112fae7a5a1223e673c8a1791d32338f37df8b527ff1159bb8adac6c4dbf1b4b",
     "sha256_packaged": "112fae7a5a1223e673c8a1791d32338f37df8b527ff1159bb8adac6c4dbf1b4b",
     "signature": {
      "team": "2DC432GLL2",
      "authority": "Developer ID Application: OpenAI OpCo, LLC (2DC432GLL2)",
      "hardened_runtime": true,
      "timestamp": true,
      "entitlements": [
       "com.apple.security.cs.allow-jit",
       "com.apple.security.cs.allow-unsigned-executable-memory"
      ]
     },
     "supplier_entitlements": [
      "com.apple.security.cs.allow-jit",
      "com.apple.security.cs.allow-unsigned-executable-memory"
     ]
    },
    {
     "path": "bin/codex-code-mode-host",
     "sha256_published": "679eedaea70529aa1cffc9bc0a0788c186412663544fa76c09d63b57f383a65a",
     "sha256_packaged": "679eedaea70529aa1cffc9bc0a0788c186412663544fa76c09d63b57f383a65a",
     "signature": {
      "team": "2DC432GLL2",
      "authority": "Developer ID Application: OpenAI OpCo, LLC (2DC432GLL2)",
      "hardened_runtime": true,
      "timestamp": true,
      "entitlements": [
       "com.apple.security.cs.allow-jit",
       "com.apple.security.cs.allow-unsigned-executable-memory"
      ]
     },
     "supplier_entitlements": [
      "com.apple.security.cs.allow-jit",
      "com.apple.security.cs.allow-unsigned-executable-memory"
     ]
    },
    {
     "path": "codex-path/rg",
     "sha256_published": "7c7d5b09c3a57de864500c65dc2e9c4d2a5e96a3fc7b7d5318480c19887a739b",
     "sha256_packaged": "7c7d5b09c3a57de864500c65dc2e9c4d2a5e96a3fc7b7d5318480c19887a739b",
     "signature": {
      "team": "2DC432GLL2",
      "authority": "Developer ID Application: OpenAI OpCo, LLC (2DC432GLL2)",
      "hardened_runtime": true,
      "timestamp": true,
      "entitlements": []
     },
     "supplier_entitlements": []
    },
    {
     "path": "codex-resources/voice/bin/codex-voice-host",
     "sha256_published": "e408413b79d76e518966046ce1d7758523c606844269fe4dd56446bed80c1062",
     "sha256_packaged": "e408413b79d76e518966046ce1d7758523c606844269fe4dd56446bed80c1062",
     "signature": {
      "team": "2DC432GLL2",
      "authority": "Developer ID Application: OpenAI OpCo, LLC (2DC432GLL2)",
      "hardened_runtime": true,
      "timestamp": true,
      "entitlements": [
       "com.apple.security.device.audio-input"
      ]
     },
     "supplier_entitlements": [
      "com.apple.security.device.audio-input"
     ]
    },
    {
     "path": "codex-resources/voice/lib/libffi.8.dylib",
     "sha256_published": "3dfe23b471423eb61bf38785c21ddb7054c5be1f87f87fbed7aa8a8c91e3bde0",
     "sha256_packaged": "3dfe23b471423eb61bf38785c21ddb7054c5be1f87f87fbed7aa8a8c91e3bde0",
     "signature": {
      "team": "2DC432GLL2",
      "authority": "Developer ID Application: OpenAI OpCo, LLC (2DC432GLL2)",
      "hardened_runtime": true,
      "timestamp": true,
      "entitlements": []
     },
     "supplier_entitlements": []
    },
    {
     "path": "codex-resources/voice/lib/libgio-2.0.0.dylib",
     "sha256_published": "b0c1b06de1deef21fde623c38a604cf413b1d607dda85644e296fb6d97067c39",
     "sha256_packaged": "b0c1b06de1deef21fde623c38a604cf413b1d607dda85644e296fb6d97067c39",
     "signature": {
      "team": "2DC432GLL2",
      "authority": "Developer ID Application: OpenAI OpCo, LLC (2DC432GLL2)",
      "hardened_runtime": true,
      "timestamp": true,
      "entitlements": []
     },
     "supplier_entitlements": []
    },
    {
     "path": "codex-resources/voice/lib/libglib-2.0.0.dylib",
     "sha256_published": "65a0785497ed134d79284c08118d8bba560f7f60e20682debe4ee12e848a5f8c",
     "sha256_packaged": "65a0785497ed134d79284c08118d8bba560f7f60e20682debe4ee12e848a5f8c",
     "signature": {
      "team": "2DC432GLL2",
      "authority": "Developer ID Application: OpenAI OpCo, LLC (2DC432GLL2)",
      "hardened_runtime": true,
      "timestamp": true,
      "entitlements": []
     },
     "supplier_entitlements": []
    },
    {
     "path": "codex-resources/voice/lib/libgmodule-2.0.0.dylib",
     "sha256_published": "3b4b70cdd569c088c28d6618b330d1acdc0fe456cf34267525c594f89e5dae84",
     "sha256_packaged": "3b4b70cdd569c088c28d6618b330d1acdc0fe456cf34267525c594f89e5dae84",
     "signature": {
      "team": "2DC432GLL2",
      "authority": "Developer ID Application: OpenAI OpCo, LLC (2DC432GLL2)",
      "hardened_runtime": true,
      "timestamp": true,
      "entitlements": []
     },
     "supplier_entitlements": []
    },
    {
     "path": "codex-resources/voice/lib/libgobject-2.0.0.dylib",
     "sha256_published": "ae78667a1a328528169ade0b18aa4ef547ce6b5f70db891781db8dab95ac46a1",
     "sha256_packaged": "ae78667a1a328528169ade0b18aa4ef547ce6b5f70db891781db8dab95ac46a1",
     "signature": {
      "team": "2DC432GLL2",
      "authority": "Developer ID Application: OpenAI OpCo, LLC (2DC432GLL2)",
      "hardened_runtime": true,
      "timestamp": true,
      "entitlements": []
     },
     "supplier_entitlements": []
    },
    {
     "path": "codex-resources/voice/lib/libgstapp-1.0.0.dylib",
     "sha256_published": "04d8b371136a375f1efe0af61d18a7605a8556b80599b2cfa0c91a5a235a43e4",
     "sha256_packaged": "04d8b371136a375f1efe0af61d18a7605a8556b80599b2cfa0c91a5a235a43e4",
     "signature": {
      "team": "2DC432GLL2",
      "authority": "Developer ID Application: OpenAI OpCo, LLC (2DC432GLL2)",
      "hardened_runtime": true,
      "timestamp": true,
      "entitlements": []
     },
     "supplier_entitlements": []
    },
    {
     "path": "codex-resources/voice/lib/libgstaudio-1.0.0.dylib",
     "sha256_published": "3fa362d9b53ef65993108a7fdc88471086e95012f5de4cb35ab37991490cfb60",
     "sha256_packaged": "3fa362d9b53ef65993108a7fdc88471086e95012f5de4cb35ab37991490cfb60",
     "signature": {
      "team": "2DC432GLL2",
      "authority": "Developer ID Application: OpenAI OpCo, LLC (2DC432GLL2)",
      "hardened_runtime": true,
      "timestamp": true,
      "entitlements": []
     },
     "supplier_entitlements": []
    },
    {
     "path": "codex-resources/voice/lib/libgstbase-1.0.0.dylib",
     "sha256_published": "437beaf6d2f2b1204a58d987d0698fd8c1c796a6c341f25c8a7a797b0e045540",
     "sha256_packaged": "437beaf6d2f2b1204a58d987d0698fd8c1c796a6c341f25c8a7a797b0e045540",
     "signature": {
      "team": "2DC432GLL2",
      "authority": "Developer ID Application: OpenAI OpCo, LLC (2DC432GLL2)",
      "hardened_runtime": true,
      "timestamp": true,
      "entitlements": []
     },
     "supplier_entitlements": []
    },
    {
     "path": "codex-resources/voice/lib/libgstnet-1.0.0.dylib",
     "sha256_published": "5173345f4b6ab9fa75ca731c8fe94ae187d6ac395eb213844312a04218924e3e",
     "sha256_packaged": "5173345f4b6ab9fa75ca731c8fe94ae187d6ac395eb213844312a04218924e3e",
     "signature": {
      "team": "2DC432GLL2",
      "authority": "Developer ID Application: OpenAI OpCo, LLC (2DC432GLL2)",
      "hardened_runtime": true,
      "timestamp": true,
      "entitlements": []
     },
     "supplier_entitlements": []
    },
    {
     "path": "codex-resources/voice/lib/libgstpbutils-1.0.0.dylib",
     "sha256_published": "e3f9bb0e56280e1572267f2cf482cd26b5341cecae4cc279e2d1dd2b6d80920c",
     "sha256_packaged": "e3f9bb0e56280e1572267f2cf482cd26b5341cecae4cc279e2d1dd2b6d80920c",
     "signature": {
      "team": "2DC432GLL2",
      "authority": "Developer ID Application: OpenAI OpCo, LLC (2DC432GLL2)",
      "hardened_runtime": true,
      "timestamp": true,
      "entitlements": []
     },
     "supplier_entitlements": []
    },
    {
     "path": "codex-resources/voice/lib/libgstreamer-1.0.0.dylib",
     "sha256_published": "0e6826b74f874848e8a0e37fdcb7f5061abc711edfb802587771c5dc1c399f1b",
     "sha256_packaged": "0e6826b74f874848e8a0e37fdcb7f5061abc711edfb802587771c5dc1c399f1b",
     "signature": {
      "team": "2DC432GLL2",
      "authority": "Developer ID Application: OpenAI OpCo, LLC (2DC432GLL2)",
      "hardened_runtime": true,
      "timestamp": true,
      "entitlements": []
     },
     "supplier_entitlements": []
    },
    {
     "path": "codex-resources/voice/lib/libgstrtp-1.0.0.dylib",
     "sha256_published": "fd50798327e0f20605c02ff133a3ca4583ebb8cf13f082205360da8b07389209",
     "sha256_packaged": "fd50798327e0f20605c02ff133a3ca4583ebb8cf13f082205360da8b07389209",
     "signature": {
      "team": "2DC432GLL2",
      "authority": "Developer ID Application: OpenAI OpCo, LLC (2DC432GLL2)",
      "hardened_runtime": true,
      "timestamp": true,
      "entitlements": []
     },
     "supplier_entitlements": []
    },
    {
     "path": "codex-resources/voice/lib/libgsttag-1.0.0.dylib",
     "sha256_published": "3b40bd0003b56507d701d3c4111ee5b8c58be3a2dcaf6da9e0a30498611222bc",